{
  "version": 1,
  "project_id": "ai-command-center",
  "display_name": "AI司令室 / Gate Q",
  "as_of": "2026-10-05",
  "risk_tier": "HIGH",
  "current_stage": "Gate Q v1.44 — executor-context remediation Human Gate",
  "status": "RUNTIME_ROOT_CAUSE_PROVEN_AWAITING_EXECUTOR_CONTEXT_HUMAN_GATE",
  "canonical": "Gate Q v1.44 Fresh Independent Static Audit remains PASS — STATIC ONLY. The single authorized Runtime Qualification attempt failed closed only because the Codex executor ran with a restricted workspace-write token that could not obtain FILE_ADD_SUBDIRECTORY access to C:\\GateQ\\v1.42\\ExecutionRoot. Static ACL policy passed; effective access for the actual restricted token was DENY. v1.44 Candidate/Controller/Manifest remain frozen and unchanged. No Replay Ledger commit occurred. Gate Q remains NOT LOCKED.",
  "locked": true,
  "lock_ref": "Existing Human Owner approved/LOCKed architecture and design artifacts only. Gate Q v1.44 itself is NOT LOCKED.",
  "last_pass": "Read-only runtime child-create diagnostic: ROOT CAUSE PROVEN. Classification WINDOWS_EFFECTIVE_ACCESS_BLOCKER. Current Codex executor token is restricted, medium-integrity, non-AppContainer, with workspace-write roots excluding C:\\GateQ; effective access to create a child in ExecutionRoot returns Win32 5 / HRESULT 0x80070005. No controller defect proven.",
  "open_findings": [
    "MAJOR-RT-CHILD-CREATE-ACCESS-01 — ROOT CAUSE PROVEN: current restricted Codex executor context cannot write to the frozen Gate Q Runtime paths. Requires Human Owner approval for a narrowly scoped executor-context/sandbox change before any new readiness/signing/runtime attempt."
  ],
  "next_action": [
    "Do not modify v1.44 Candidate, Controller, Manifest, frozen Runtime paths, or existing ACLs/owners.",
    "Human Owner must decide whether to permit a narrowly scoped executor context whose additional writable roots are exactly C:\\GateQ\\v1.42\\ExecutionRoot and C:\\GateQ\\v1.42\\Replay, with no broader filesystem permission expansion and no elevation unless independently required and explicitly approved.",
    "If approved, change only the executor/sandbox context, then run read-only readiness checks first; do not immediately generate authorization or sign.",
    "After readiness PASS in the new executor context, generate a fresh live authorization and stop at the separate signing Human Gate; the consumed/expired GQv144-c50877e336da4668ad9dcf1f078b5c35 record must never be reused.",
    "After signing verification, stop again at the separate Runtime Qualification execution Human Gate. Runtime PASS would still not authorize Gate Q LOCK, Gate A, Stage 0B, WSL changes, or Production."
  ],
  "human_approval_required": true,
  "audit_mode": "MACHINE_PREFLIGHT_THEN_AI_SEMANTIC_THEN_FRESH_AUDIT_FOR_NEW_HIGH_RISK_CANDIDATES_THEN_HUMAN_GATE; DO_NOT_REAUDIT_EXISTING_PASS_WITHOUT_NEW_EVIDENCE_OR_CHANGE",
  "model_route": {
    "routine": "Instant/Low",
    "analysis": "Medium",
    "final_gate": "High"
  },
  "source_of_truth": [
    "GitHub:Tsuchimaru0403/tsuchimaru-ai-command-center",
    "GitHub:ops/states/ai-command-center.json",
    "Gate Q v1.44 Fresh Independent Static Audit PASS reported 2026-10-05",
    "Notion:01｜AI司令室・自動化基盤"
  ],
  "migration_note": "AI OPERATING EFFICIENCY POLICY v1 remains active. Runtime-only root cause is proven, so no new Fresh Static Audit is required unless controller/candidate bytes or security semantics change. The next boundary is a Human Owner permission decision for executor writable-root scope."
}
